{
  "schemaVersion": "plugins.mojobox.dev/v1",
  "sourceId": "dsh-eac.mojobox",
  "revision": "sha256:a997ff426b742a6cb2bd5de80da03fe7967f17f0b5ecd5757cd8fcef7333264c",
  "demo": false,
  "plugins": [
    {
      "listing": {
        "format": "mojobox-plugin-listing-v1",
        "id": "org.example.tools",
        "packageName": "@example/tools",
        "name": "Example tools",
        "version": "1.0.0",
        "summary": "Test fixture only",
        "source": {
          "url": "https://example.org/releases/1.0.0"
        },
        "license": null,
        "compatibility": {
          "dsh": null,
          "basis": "unknown"
        },
        "conflicts": null
      },
      "checks": "metadata-only",
      "runtime": "not-tested",
      "dependencies": "not-resolved",
      "download": null,
      "report": null
    }
  ]
}
